{
  "version": "0.2",
  "runId": "swe-agent-run-7",
  "model": "example-model",
  "provider": "example",
  "tokenizer": "harness-provided",
  "traceBoundary": "final-provider-payload",
  "contextWindow": 128000,
  "analysisMode": "heuristic",
  "turn": 3,
  "segments": [
    {
      "id": "system.runtime-policy",
      "type": "system",
      "source": "harness.runtime",
      "tokens": 6800,
      "utility": 0.97,
      "protected": true,
      "turnAdded": 1,
      "turnLastSeen": 3
    },
    {
      "id": "developer.repo-conventions",
      "type": "developer",
      "source": "workspace.policy",
      "tokens": 4200,
      "utility": 0.93,
      "protected": true,
      "turnAdded": 1,
      "turnLastSeen": 3
    },
    {
      "id": "user.issue-1841",
      "type": "user",
      "source": "chat",
      "tokens": 1250,
      "utility": 1.0,
      "protected": true,
      "turnAdded": 1,
      "turnLastSeen": 3
    },
    {
      "id": "history.turns-1-2",
      "type": "history",
      "source": "conversation",
      "tokens": 3400,
      "utility": 0.61,
      "turnAdded": 1,
      "turnLastSeen": 3
    },
    {
      "id": "tool.grep.symbol-search",
      "type": "tool",
      "source": "grep",
      "tokens": 5200,
      "utility": 0.74,
      "relevance": 0.85,
      "turnAdded": 2,
      "turnLastSeen": 3
    },
    {
      "id": "code.auth-middleware",
      "type": "code",
      "source": "workspace.read",
      "tokens": 4800,
      "utility": 0.91,
      "relevance": 0.95,
      "density": 1.2,
      "turnAdded": 3
    }
  ]
}
