{
  "version": "0.2",
  "runId": "research-agent-optimized",
  "provider": "example-provider",
  "model": "example-model",
  "tokenizer": "provider-reported",
  "traceBoundary": "final-provider-payload",
  "contextWindow": 128000,
  "turn": 8,
  "analysisMode": "heuristic",
  "segments": [
    {
      "id": "system.runtime-policy",
      "type": "system",
      "source": "harness",
      "tokens": 6800,
      "turnAdded": 1,
      "protected": true,
      "relevance": 1,
      "density": 1.15,
      "authority": 1.45,
      "utility": 0.98
    },
    {
      "id": "developer.agent-contract",
      "type": "developer",
      "source": "blacksite-harness",
      "tokens": 4200,
      "turnAdded": 1,
      "protected": true,
      "relevance": 0.96,
      "density": 1.1,
      "authority": 1.35,
      "utility": 0.94
    },
    {
      "id": "user.current-request",
      "type": "user",
      "source": "conversation",
      "tokens": 1250,
      "turnAdded": 8,
      "protected": true,
      "relevance": 1,
      "authority": 1.3,
      "utility": 1
    },
    {
      "id": "summary.conversation-state",
      "type": "summary",
      "source": "harness.compactor",
      "tokens": 3100,
      "turnAdded": 7,
      "relevance": 0.82,
      "density": 1.2,
      "utility": 0.79
    },
    {
      "id": "tool.github.targeted-symbols",
      "type": "tool",
      "source": "github.search_symbols",
      "tokens": 4200,
      "turnAdded": 8,
      "relevance": 0.86,
      "density": 1.12,
      "utility": 0.8
    },
    {
      "id": "workspace.targeted-excerpts",
      "type": "workspace",
      "source": "workspace.read_symbols",
      "tokens": 5400,
      "turnAdded": 8,
      "duplicateRatio": 0.03,
      "relevance": 0.84,
      "density": 1.2,
      "utility": 0.82
    },
    {
      "id": "browser.accessibility-excerpt",
      "type": "browser",
      "source": "browser.extract_relevant",
      "tokens": 2600,
      "turnAdded": 8,
      "relevance": 0.78,
      "density": 0.95,
      "utility": 0.7
    },
    {
      "id": "rag.architecture-docs",
      "type": "rag",
      "source": "vector.search",
      "tokens": 7200,
      "turnAdded": 8,
      "duplicateRatio": 0.04,
      "relevance": 0.84,
      "density": 1.16,
      "utility": 0.8
    }
  ]
}
